{
  "schema_version": "1.0.0",
  "release_id": "priced-resource-accounting-conformance-internal-v1",
  "purpose": "Retain a zero-call cross-shape conformance slice for partial priced-resource and denominator accounting without licensing cost or value claims.",
  "evidence_basis": [
    {"path": "papers/agent-benchmarks/2026-07-18-cost-aware-security-agent-evaluation.md", "sha256": "1a1e27915923b6fe8e32485727ddb5170687fc8dae7ef260818393badc82a39f"},
    {"path": "pilots/priced-resource-accounting-conformance/rate-sheet.json", "sha256": "9072083add888aed1695e9b4172f203e5bac23fad63f226abf43c825835331fc"}
  ],
  "aggregation": {
    "aggregation_id": "priced-resource-denominator-ledger-v1",
    "version": "1.0.0",
    "estimand": "Separate partial charged spend by campaign attempt, canonical valid trial, success, and retained-valid views.",
    "rule": "Sum every attempt charge for campaign spend; retain canonical valid charges separately; never combine distinct price bases.",
    "denominator_policy": "Report all attempt records, canonical valid scored trials, canonical successes, and retained-valid-only cost separately.",
    "missing_invalid_policy": "Retain invalid, failed, and retry attempts in campaign spend; prohibit them from valid/success denominators.",
    "spec_sha256": "b2c8ac7826af8697945df96a3a31b63bac52705d234ca1b7f15fef745526cc7b"
  },
  "packages": [
    {
      "release_item_id": "priced-incident-review-item-v1",
      "package_id": "priced-incident-evidence-review-v1",
      "version": "1.0.0",
      "work_shape": "source-grounded incident evidence review with retry replacement",
      "task_ids": ["incident-01"],
      "redistribution": {"status": "affirmed_builder_authored_internal_fixtures", "basis": "The README records builder authorship and the internal synthetic calibration boundary.", "evidence": {"path": "pilots/priced-resource-accounting-conformance/README.md", "sha256": "65c84f78ad8b661ebda9c6075d3f517d5eab65313f6c13304ab6911801e1a4e6"}},
      "aggregation_id": "priced-resource-denominator-ledger-v1",
      "aggregation_spec_sha256": "b2c8ac7826af8697945df96a3a31b63bac52705d234ca1b7f15fef745526cc7b",
      "components": [
        {"component_id": "incident-package-manifest", "role": "package_manifest", "path": "pilots/priced-resource-accounting-conformance/package.json", "sha256": "8c40a74d808d32dfd28368a510c85cc1d8fb11691452c85f674443e0294a91dd", "language": "json", "compile_check": "json_parse", "trust": "builder_authored_retained"},
        {"component_id": "incident-rate-contract", "role": "task_contract", "path": "pilots/priced-resource-accounting-conformance/rate-sheet.json", "sha256": "9072083add888aed1695e9b4172f203e5bac23fad63f226abf43c825835331fc", "language": "json", "compile_check": "json_parse", "trust": "builder_authored_retained"},
        {"component_id": "incident-replay-runner", "role": "replay_runner", "path": "pilots/priced-resource-accounting-conformance/replay.py", "sha256": "fbc33a9aac958f4c0eacbaeb6d7003d105afedfc86d1c1c9157d4c875ffd2062", "language": "python", "compile_check": "python_compile", "trust": "builder_authored_retained"},
        {"component_id": "incident-result-evidence", "role": "result_evidence", "path": "pilots/priced-resource-accounting-conformance/replay-report.json", "sha256": "3f16bfb1a3f6bc367af5a881f51c76fad0c011296810bbe8fab8a049e6f50a53", "language": "json", "compile_check": "json_parse", "trust": "builder_authored_retained"},
        {"component_id": "incident-rights-evidence", "role": "rights_evidence", "path": "pilots/priced-resource-accounting-conformance/README.md", "sha256": "65c84f78ad8b661ebda9c6075d3f517d5eab65313f6c13304ab6911801e1a4e6", "language": "markdown", "compile_check": "not_executable", "trust": "builder_authored_retained"}
      ],
      "containment": {"status": "trusted_builder_code_only", "untrusted_execution_allowed": false, "network": "not_requested_but_not_kernel_blocked", "filesystem": "repository_read_and_same_byte_report_write", "process_resource_boundary": "subprocess_timeout_only"},
      "controls": [{"control_id": "incident-zero-call-replay", "runner_component_id": "incident-replay-runner", "argv": ["python", "pilots/priced-resource-accounting-conformance/replay.py"], "zero_cost": true, "expected_exit": 0, "timeout_seconds": 30, "expected_stdout": {"json_path": "pilots/priced-resource-accounting-conformance/replay-report.json"}, "result_evidence": {"path": "pilots/priced-resource-accounting-conformance/replay-report.json", "sha256": "3f16bfb1a3f6bc367af5a881f51c76fad0c011296810bbe8fab8a049e6f50a53"}, "expected_evidence": [{"pointer": "/valid", "equals": true}, {"pointer": "/planted_distinctions/higher_cap_lower_spend", "equals": true}, {"pointer": "/planted_distinctions/failed_retry_separate_from_retained_valid_cost", "equals": true}]}],
      "claim_ceiling": {"agent_capability": false, "professional_validity": false, "production_safety": false, "production_fitness": false, "public_release_readiness": false, "cross_domain_generalization": false}
    },
    {
      "release_item_id": "priced-spreadsheet-item-v1",
      "package_id": "priced-spreadsheet-reconciliation-v1",
      "version": "1.0.0",
      "work_shape": "structured spreadsheet reconciliation and artifact acceptance",
      "task_ids": ["sheet-01", "sheet-02", "sheet-03"],
      "redistribution": {"status": "affirmed_builder_authored_internal_fixtures", "basis": "The README records builder authorship and the internal synthetic calibration boundary.", "evidence": {"path": "pilots/priced-resource-accounting-conformance/README.md", "sha256": "65c84f78ad8b661ebda9c6075d3f517d5eab65313f6c13304ab6911801e1a4e6"}},
      "aggregation_id": "priced-resource-denominator-ledger-v1",
      "aggregation_spec_sha256": "b2c8ac7826af8697945df96a3a31b63bac52705d234ca1b7f15fef745526cc7b",
      "components": [
        {"component_id": "sheet-package-manifest", "role": "package_manifest", "path": "pilots/priced-resource-accounting-conformance/package.json", "sha256": "8c40a74d808d32dfd28368a510c85cc1d8fb11691452c85f674443e0294a91dd", "language": "json", "compile_check": "json_parse", "trust": "builder_authored_retained"},
        {"component_id": "sheet-rate-contract", "role": "task_contract", "path": "pilots/priced-resource-accounting-conformance/rate-sheet.json", "sha256": "9072083add888aed1695e9b4172f203e5bac23fad63f226abf43c825835331fc", "language": "json", "compile_check": "json_parse", "trust": "builder_authored_retained"},
        {"component_id": "sheet-replay-runner", "role": "replay_runner", "path": "pilots/priced-resource-accounting-conformance/replay.py", "sha256": "fbc33a9aac958f4c0eacbaeb6d7003d105afedfc86d1c1c9157d4c875ffd2062", "language": "python", "compile_check": "python_compile", "trust": "builder_authored_retained"},
        {"component_id": "sheet-result-evidence", "role": "result_evidence", "path": "pilots/priced-resource-accounting-conformance/replay-report.json", "sha256": "3f16bfb1a3f6bc367af5a881f51c76fad0c011296810bbe8fab8a049e6f50a53", "language": "json", "compile_check": "json_parse", "trust": "builder_authored_retained"},
        {"component_id": "sheet-rights-evidence", "role": "rights_evidence", "path": "pilots/priced-resource-accounting-conformance/README.md", "sha256": "65c84f78ad8b661ebda9c6075d3f517d5eab65313f6c13304ab6911801e1a4e6", "language": "markdown", "compile_check": "not_executable", "trust": "builder_authored_retained"}
      ],
      "containment": {"status": "trusted_builder_code_only", "untrusted_execution_allowed": false, "network": "not_requested_but_not_kernel_blocked", "filesystem": "repository_read_and_same_byte_report_write", "process_resource_boundary": "subprocess_timeout_only"},
      "controls": [{"control_id": "sheet-zero-call-replay", "runner_component_id": "sheet-replay-runner", "argv": ["python", "pilots/priced-resource-accounting-conformance/replay.py"], "zero_cost": true, "expected_exit": 0, "timeout_seconds": 30, "expected_stdout": {"json_path": "pilots/priced-resource-accounting-conformance/replay-report.json"}, "result_evidence": {"path": "pilots/priced-resource-accounting-conformance/replay-report.json", "sha256": "3f16bfb1a3f6bc367af5a881f51c76fad0c011296810bbe8fab8a049e6f50a53"}, "expected_evidence": [{"pointer": "/valid", "equals": true}, {"pointer": "/planted_distinctions/cached_counterfactual_separate_from_charge", "equals": true}, {"pointer": "/planted_distinctions/denominator_rank_reversal", "equals": true}]}],
      "claim_ceiling": {"agent_capability": false, "professional_validity": false, "production_safety": false, "production_fitness": false, "public_release_readiness": false, "cross_domain_generalization": false}
    }
  ],
  "claim_ceiling": {"agent_capability": false, "professional_validity": false, "production_safety": false, "production_fitness": false, "public_release_readiness": false, "cross_domain_generalization": false}
}
